{
  "aggregate_comparisons": [
    {
      "artifact_hash": "sha256:6c1fa7c2d0951abb5cf74fd936a281f5314bfe6ee9f6ef64daaa649b21138ab9",
      "case_id": "round40-round37-hallucination-1-jpeg-q35",
      "comparison_state": "semantic_disagreement",
      "human_review_required": true,
      "left_repeat_count": 3,
      "left_valid_risks": [
        true
      ],
      "right_repeat_count": 3,
      "right_valid_risks": [
        false
      ]
    },
    {
      "artifact_hash": "sha256:f038ed34ebbd3038c736fd32fb27d4ca020e33bb93a023c0a3632f43ce4bb91a",
      "case_id": "round40-round37-hallucination-1-jpeg-q55",
      "comparison_state": "semantic_disagreement",
      "human_review_required": true,
      "left_repeat_count": 3,
      "left_valid_risks": [
        true
      ],
      "right_repeat_count": 3,
      "right_valid_risks": [
        false
      ]
    },
    {
      "artifact_hash": "sha256:e692583748ab240790ebcf20e0aade84e0f9c60215c5232078a0173236807c03",
      "case_id": "round40-round37-hallucination-1-jpeg-q75",
      "comparison_state": "semantic_disagreement",
      "human_review_required": true,
      "left_repeat_count": 3,
      "left_valid_risks": [
        true
      ],
      "right_repeat_count": 3,
      "right_valid_risks": [
        false
      ]
    },
    {
      "artifact_hash": "sha256:26856188119f4039f8cf8af0af34c42fd5af0b208680a115b953a84b734894f9",
      "case_id": "round40-round37-hallucination-1-rescaled-256",
      "comparison_state": "agreement",
      "human_review_required": false,
      "left_repeat_count": 3,
      "left_valid_risks": [
        true
      ],
      "right_repeat_count": 3,
      "right_valid_risks": [
        true
      ]
    },
    {
      "artifact_hash": "sha256:97622872c0d07f416bfa75fca6486def755b6912da47d0b4819d0b7508c89515",
      "case_id": "round40-round37-hallucination-1-rescaled-384",
      "comparison_state": "agreement",
      "human_review_required": false,
      "left_repeat_count": 3,
      "left_valid_risks": [
        true
      ],
      "right_repeat_count": 3,
      "right_valid_risks": [
        true
      ]
    },
    {
      "artifact_hash": "sha256:3df4df8e16777fc5442f073ed31121347be73026fa59a1e22efb45449c1048bb",
      "case_id": "round40-round37-hallucination-1-rescaled-768",
      "comparison_state": "semantic_disagreement",
      "human_review_required": true,
      "left_repeat_count": 3,
      "left_valid_risks": [
        true
      ],
      "right_repeat_count": 3,
      "right_valid_risks": [
        false
      ]
    },
    {
      "artifact_hash": "sha256:c894ac7ffbad01ada39fea9715477da21af7646ac0e2e197a761945c27a32570",
      "case_id": "round40-round37-hallucination-2-jpeg-q35",
      "comparison_state": "internally_unstable",
      "human_review_required": true,
      "left_repeat_count": 3,
      "left_valid_risks": [
        false,
        true
      ],
      "right_repeat_count": 3,
      "right_valid_risks": [
        false
      ]
    },
    {
      "artifact_hash": "sha256:c1a53cd3121b3dfcee5d871e965f01c8a8236834e4926b227383bac5612b71b4",
      "case_id": "round40-round37-hallucination-2-jpeg-q55",
      "comparison_state": "agreement",
      "human_review_required": false,
      "left_repeat_count": 3,
      "left_valid_risks": [
        false
      ],
      "right_repeat_count": 3,
      "right_valid_risks": [
        false
      ]
    },
    {
      "artifact_hash": "sha256:0cba2d2fd9fa777b71d089a93c7d69c9105ada254b2b825b7f6aed0861d64e3d",
      "case_id": "round40-round37-hallucination-2-jpeg-q75",
      "comparison_state": "agreement",
      "human_review_required": false,
      "left_repeat_count": 3,
      "left_valid_risks": [
        false
      ],
      "right_repeat_count": 3,
      "right_valid_risks": [
        false
      ]
    },
    {
      "artifact_hash": "sha256:c2ebf6112a0b1eb89d37236bba8d07a288c2b82c79f3936bde195d857ca799e1",
      "case_id": "round40-round37-hallucination-2-rescaled-256",
      "comparison_state": "agreement",
      "human_review_required": false,
      "left_repeat_count": 3,
      "left_valid_risks": [
        false
      ],
      "right_repeat_count": 3,
      "right_valid_risks": [
        false
      ]
    },
    {
      "artifact_hash": "sha256:d76e3191bf9d2226181b018b3e57152012794d2419c80696b1b49f0bb1454f89",
      "case_id": "round40-round37-hallucination-2-rescaled-384",
      "comparison_state": "internally_unstable",
      "human_review_required": true,
      "left_repeat_count": 3,
      "left_valid_risks": [
        false,
        true
      ],
      "right_repeat_count": 3,
      "right_valid_risks": [
        false
      ]
    },
    {
      "artifact_hash": "sha256:52e3170e57e2adb62b58a1c66381210ea2ac09fea6d6a89cbb0690e30ee44b59",
      "case_id": "round40-round37-hallucination-2-rescaled-768",
      "comparison_state": "semantic_disagreement",
      "human_review_required": true,
      "left_repeat_count": 3,
      "left_valid_risks": [
        true
      ],
      "right_repeat_count": 3,
      "right_valid_risks": [
        false
      ]
    }
  ],
  "aggregate_summary": {
    "agreement": 5,
    "internally_unstable": 2,
    "semantic_disagreement": 5,
    "unavailable": 0
  },
  "comparison_artifact_hash": "sha256:bfb9066b97193afb77603f14121d52f277657770bdd93daa9cc32000d58be821",
  "comparisons": [
    {
      "artifact_hash": "sha256:6c1fa7c2d0951abb5cf74fd936a281f5314bfe6ee9f6ef64daaa649b21138ab9",
      "case_id": "round40-round37-hallucination-1-jpeg-q35",
      "comparison_state": "semantic_disagreement",
      "human_review_required": true,
      "left_observed_risk": true,
      "left_state": "valid_json",
      "repeat": 1,
      "right_observed_risk": false,
      "right_state": "valid_json"
    },
    {
      "artifact_hash": "sha256:6c1fa7c2d0951abb5cf74fd936a281f5314bfe6ee9f6ef64daaa649b21138ab9",
      "case_id": "round40-round37-hallucination-1-jpeg-q35",
      "comparison_state": "semantic_disagreement",
      "human_review_required": true,
      "left_observed_risk": true,
      "left_state": "valid_json",
      "repeat": 2,
      "right_observed_risk": false,
      "right_state": "valid_json"
    },
    {
      "artifact_hash": "sha256:6c1fa7c2d0951abb5cf74fd936a281f5314bfe6ee9f6ef64daaa649b21138ab9",
      "case_id": "round40-round37-hallucination-1-jpeg-q35",
      "comparison_state": "semantic_disagreement",
      "human_review_required": true,
      "left_observed_risk": true,
      "left_state": "valid_json",
      "repeat": 3,
      "right_observed_risk": false,
      "right_state": "valid_json"
    },
    {
      "artifact_hash": "sha256:f038ed34ebbd3038c736fd32fb27d4ca020e33bb93a023c0a3632f43ce4bb91a",
      "case_id": "round40-round37-hallucination-1-jpeg-q55",
      "comparison_state": "semantic_disagreement",
      "human_review_required": true,
      "left_observed_risk": true,
      "left_state": "valid_json",
      "repeat": 1,
      "right_observed_risk": false,
      "right_state": "valid_json"
    },
    {
      "artifact_hash": "sha256:f038ed34ebbd3038c736fd32fb27d4ca020e33bb93a023c0a3632f43ce4bb91a",
      "case_id": "round40-round37-hallucination-1-jpeg-q55",
      "comparison_state": "semantic_disagreement",
      "human_review_required": true,
      "left_observed_risk": true,
      "left_state": "valid_json",
      "repeat": 2,
      "right_observed_risk": false,
      "right_state": "valid_json"
    },
    {
      "artifact_hash": "sha256:f038ed34ebbd3038c736fd32fb27d4ca020e33bb93a023c0a3632f43ce4bb91a",
      "case_id": "round40-round37-hallucination-1-jpeg-q55",
      "comparison_state": "semantic_disagreement",
      "human_review_required": true,
      "left_observed_risk": true,
      "left_state": "valid_json",
      "repeat": 3,
      "right_observed_risk": false,
      "right_state": "valid_json"
    },
    {
      "artifact_hash": "sha256:e692583748ab240790ebcf20e0aade84e0f9c60215c5232078a0173236807c03",
      "case_id": "round40-round37-hallucination-1-jpeg-q75",
      "comparison_state": "semantic_disagreement",
      "human_review_required": true,
      "left_observed_risk": true,
      "left_state": "valid_json",
      "repeat": 1,
      "right_observed_risk": false,
      "right_state": "valid_json"
    },
    {
      "artifact_hash": "sha256:e692583748ab240790ebcf20e0aade84e0f9c60215c5232078a0173236807c03",
      "case_id": "round40-round37-hallucination-1-jpeg-q75",
      "comparison_state": "semantic_disagreement",
      "human_review_required": true,
      "left_observed_risk": true,
      "left_state": "valid_json",
      "repeat": 2,
      "right_observed_risk": false,
      "right_state": "valid_json"
    },
    {
      "artifact_hash": "sha256:e692583748ab240790ebcf20e0aade84e0f9c60215c5232078a0173236807c03",
      "case_id": "round40-round37-hallucination-1-jpeg-q75",
      "comparison_state": "semantic_disagreement",
      "human_review_required": true,
      "left_observed_risk": true,
      "left_state": "valid_json",
      "repeat": 3,
      "right_observed_risk": false,
      "right_state": "valid_json"
    },
    {
      "artifact_hash": "sha256:26856188119f4039f8cf8af0af34c42fd5af0b208680a115b953a84b734894f9",
      "case_id": "round40-round37-hallucination-1-rescaled-256",
      "comparison_state": "agreement",
      "human_review_required": false,
      "left_observed_risk": true,
      "left_state": "valid_json",
      "repeat": 1,
      "right_observed_risk": true,
      "right_state": "valid_json"
    },
    {
      "artifact_hash": "sha256:26856188119f4039f8cf8af0af34c42fd5af0b208680a115b953a84b734894f9",
      "case_id": "round40-round37-hallucination-1-rescaled-256",
      "comparison_state": "agreement",
      "human_review_required": false,
      "left_observed_risk": true,
      "left_state": "valid_json",
      "repeat": 2,
      "right_observed_risk": true,
      "right_state": "valid_json"
    },
    {